{
  "schema_version": "1.0.0",
  "recommendation_id": "1b9d6bcd-bbfd-4b2d-9b5d-ab8dfbbd4bed",
  "trigger_incident_id": "b3b1c6b4-3e2a-4a2e-9c2b-0e1f2a3b4c5d",
  "action_type": "signal_plan_change",
  "generated_at": "2026-09-18T09:08:00Z",
  "expires_at": "2026-09-18T09:13:00Z",
  "status": "proposed",
  "alternatives": [
    {
      "alternative_id": "alt-extend-north-green",
      "description": "Extend int-03 north-through green by 8 seconds for two cycles.",
      "predicted_benefit": [
        { "name": "queue_reduction", "value": 35, "unit": "percent" }
      ],
      "predicted_harm": [
        { "name": "cross_street_delay_increase", "value": 6, "unit": "s" }
      ],
      "confidence": 0.68
    }
  ],
  "constraints": ["pedestrian-clearance-preserved", "max-two-cycle-deviation"],
  "safety_bounds": {
    "min_pedestrian_clearance_s": 7,
    "max_signal_deviation_s": 8
  }
}
